{
  "id": "123456",
  "name": "Example Project",
  "created_at": "2026-04-17T12:00:00Z",
  "domain": "example_value",
  "enabled": "example_value",
  "managed": "example_value",
  "provider_type": "example_value",
  "platform_type": "2026-04-17T12:00:00Z",
  "environment_scope": "example_value",
  "cluster_type": "example_value"
}